,Tweets,new,tidy_text,tok,nouns,clean_tweet,is_retweet,retweeted,mentioned,hashtags,cluster
2437,@_Alphatech_ @archiegee64 😂Didn't realise Cadbury was in India too! Makes me wanna visit even more!,@_Alphatech_ @archiegee64 😂Didn't realise Cadbury was in India too! Makes me wanna visit even more!,Didn realise Cadbury India Makes wanna visit even more,"['Didn', 'realise', 'Cadbury', 'India', 'Makes', 'wan', 'na', 'visit', 'even', 'more']","['Didn', 'realise', 'Cadbury', 'India', 'Makes', 'wan']", alphatech 😂didn realis cadburi india make wanna visit even ,False,[],['@archiegee64'],[],6
2440,"@tony_zy @glynmoody Well, India is ahead of China with union ministers flogging magical “herbal” cures and magic po… https://t.co/LiginsMgxt","@tony_zy @glynmoody Well, India is ahead of China with union ministers flogging magical “herbal” cures and magic po… ",Well India ahead China with union ministers flogging magical herbal cures magic,"['Well', 'India', 'ahead', 'China', 'with', 'union', 'ministers', 'flogging', 'magical', 'herbal', 'cures', 'magic']","['India', 'China', 'union', 'ministers', 'cures']", well india ahead china union minist flog magic “herbal” cure magic po… ,False,[],"['@tony_zy', '@glynmoody']",[],6
2444,RT @VidyaKrishnan: Delighted? Mortuaries are running at full capacity.,RT @VidyaKrishnan: Delighted? Mortuaries are running at full capacity.,Delighted Mortuaries running full capacity,"['Delighted', 'Mortuaries', 'running', 'full', 'capacity']","['Mortuaries', 'capacity']", delight mortuari run full capac ,True,['@VidyaKrishnan'],[],[],6
2452,"RT @FabienBrodie: Top 12 'No-Code' Machine Learning Platforms In 2021 - Analytics India Magazine

Read more here: https://t.co/3voTqrTZkR…","RT @FabienBrodie: Top 12 'No-Code' Machine Learning Platforms In 2021 - Analytics India Magazine

Read more here: ",Code Machine Learning Platforms Analytics India Magazine Read more here,"['Code', 'Machine', 'Learning', 'Platforms', 'Analytics', 'India', 'Magazine', 'Read', 'more', 'here']","['Code', 'Machine', 'Learning', 'Platforms', 'Analytics', 'India', 'Magazine', 'Read']", top  code machin learn platform  analyt india magazin read ,True,['@FabienBrodie'],[],[],6
2454,"RT @Suhelseth: You might also wish us Happy Vaisakhi, Ugadi, Navratri, and tomorrow, Vishu too. Since India IS one of your biggest markets.…","RT @Suhelseth: You might also wish us Happy Vaisakhi, Ugadi, Navratri, and tomorrow, Vishu too. Since India IS one of your biggest markets.…",might also wish Happy Vaisakhi Ugadi Navratri tomorrow Vishu Since India your biggest markets,"['might', 'also', 'wish', 'Happy', 'Vaisakhi', 'Ugadi', 'Navratri', 'tomorrow', 'Vishu', 'Since', 'India', 'your', 'biggest', 'markets']","['Happy', 'Vaisakhi', 'Ugadi', 'Navratri', 'tomorrow', 'Vishu', 'India', 'markets']", might also wish us happi vaisakhi ugadi navratri tomorrow vishu sinc india one biggest market …,True,['@Suhelseth'],[],[],6
2458,Union Minister Santosh Gangwar Tests Positive For COVID-19 https://t.co/SSShHLenpS https://t.co/8vGBUn4CC7,Union Minister Santosh Gangwar Tests Positive For COVID-19  ,Union Minister Santosh Gangwar Tests Positive COVID,"['Union', 'Minister', 'Santosh', 'Gangwar', 'Tests', 'Positive', 'COVID']","['Union', 'Minister', 'Santosh', 'Gangwar', 'Tests', 'Positive', 'COVID']",union minist santosh gangwar test posit covid  ,False,[],[],[],6
2461,RT @vijaytaAAP: In coming days india will cross the cases up-to 200k to 250k. And so many people will die because of government irresponsib…,RT @vijaytaAAP: In coming days india will cross the cases up-to 200k to 250k. And so many people will die because of government irresponsib…,coming days india will cross cases many people will because government irresponsib,"['coming', 'days', 'india', 'will', 'cross', 'cases', 'many', 'people', 'will', 'because', 'government', 'irresponsib']","['days', 'cases', 'people', 'government', 'irresponsib']", come day india cross case k k mani peopl die govern irresponsib…,True,['@vijaytaAAP'],[],[],6
2479,"RT @drharshvardhan: Delighted to share GoI's remarkable initiative to augment our basket of #COVID19vaccines

#COVIDVaccines which have bee…","RT @drharshvardhan: Delighted to share GoI's remarkable initiative to augment our basket of #COVID19vaccines

#COVIDVaccines which have bee…",Delighted share remarkable initiative augment basket #COVID vaccines #COVIDVaccines which have,"['Delighted', 'share', 'remarkable', 'initiative', 'augment', 'basket', '#', 'COVID', 'vaccines', '#', 'COVIDVaccines', 'which', 'have']","['share', 'augment', 'basket', 'COVID', 'vaccines', 'COVIDVaccines']", delight share goi remark initi augment basket #covidvaccines #covidvaccines bee…,True,['@drharshvardhan'],[],"['#COVID19vaccines', '#COVIDVaccines']",6
2480,"RT @priy_dutta: Heard about stocks?📉

Do you know which technology is it related to?

Let's grab some knowledge about the latest technology…","RT @priy_dutta: Heard about stocks?📉

Do you know which technology is it related to?

Let's grab some knowledge about the latest technology…",Heard about stocks know which technology related grab some knowledge about latest technology,"['Heard', 'about', 'stocks', 'know', 'which', 'technology', 'related', 'grab', 'some', 'knowledge', 'about', 'latest', 'technology']","['Heard', 'stocks', 'technology', 'knowledge', 'technology']", heard stock 📉 know technolog relat let grab knowledg latest technology…,True,['@priy_dutta'],[],[],6
2501,RT @VidyaKrishnan: Delighted? Mortuaries are running at full capacity. https://t.co/u1TQTOV6ww,RT @VidyaKrishnan: Delighted? Mortuaries are running at full capacity. ,Delighted Mortuaries running full capacity,"['Delighted', 'Mortuaries', 'running', 'full', 'capacity']","['Mortuaries', 'capacity']", delight mortuari run full capac ,True,['@VidyaKrishnan'],[],[],6
2511,"RT @Suhelseth: You might also wish us Happy Vaisakhi, Ugadi, Navratri, and tomorrow, Vishu too. Since India IS one of your biggest markets.…","RT @Suhelseth: You might also wish us Happy Vaisakhi, Ugadi, Navratri, and tomorrow, Vishu too. Since India IS one of your biggest markets.…",might also wish Happy Vaisakhi Ugadi Navratri tomorrow Vishu Since India your biggest markets,"['might', 'also', 'wish', 'Happy', 'Vaisakhi', 'Ugadi', 'Navratri', 'tomorrow', 'Vishu', 'Since', 'India', 'your', 'biggest', 'markets']","['Happy', 'Vaisakhi', 'Ugadi', 'Navratri', 'tomorrow', 'Vishu', 'India', 'markets']", might also wish us happi vaisakhi ugadi navratri tomorrow vishu sinc india one biggest market …,True,['@Suhelseth'],[],[],6
2515,"Machine Learning and Deep Learning: How to get started, job opportunities and future scope - India Today

Read more… https://t.co/kWf3OQZcfP","Machine Learning and Deep Learning: How to get started, job opportunities and future scope - India Today

Read more… ",Machine Learning Deep Learning started opportunities future scope India Today Read more,"['Machine', 'Learning', 'Deep', 'Learning', 'started', 'opportunities', 'future', 'scope', 'India', 'Today', 'Read', 'more']","['Machine', 'Learning', 'Deep', 'Learning', 'opportunities', 'scope', 'India', 'Today', 'Read']",machin learn deep learn get start job opportun futur scope india today read more… ,False,[],[],[],6
2527,"RT @RavinderKapur2: Look at the US’s sharp fall in COVID cases since Trump was removed in Jan and Biden took over.

You can be sure there a…","RT @RavinderKapur2: Look at the US’s sharp fall in COVID cases since Trump was removed in Jan and Biden took over.

You can be sure there a…",Look sharp fall COVID cases since Trump removed Biden took over sure there,"['Look', 'sharp', 'fall', 'COVID', 'cases', 'since', 'Trump', 'removed', 'Biden', 'took', 'over', 'sure', 'there']","['Look', 'fall', 'COVID', 'cases', 'Trump', 'Biden']", look us’ sharp fall covid case sinc trump remov jan biden took sure a…,True,['@RavinderKapur2'],[],[],6
2535,"RT @sensible56: #ModiFailsIndia 
If only Modi listened to @RahulGandhi
If only RG was our PM.

Give everyone vaccine, stop 'eventbaazi': Ra…","RT @sensible56: #ModiFailsIndia 
If only Modi listened to @RahulGandhi
If only RG was our PM.

Give everyone vaccine, stop 'eventbaazi': Ra…",#ModiFailsIndia only Modi listened only Give everyone vaccine stop eventbaazi,"['#', 'ModiFailsIndia', 'only', 'Modi', 'listened', 'only', 'Give', 'everyone', 'vaccine', 'stop', 'eventbaazi']","['ModiFailsIndia', 'Modi', 'Give', 'everyone', 'vaccine', 'stop', 'eventbaazi']", #modifailsindia modi listen rg pm give everyon vaccin stop eventbaazi ra…,True,['@sensible56'],['@RahulGandhi'],['#ModiFailsIndia'],6
2556,"RT @priyankac19: Also, for all those cabinet ministers screeching, politicising and  tweeting that there no vaccine shortage at all, I offe…","RT @priyankac19: Also, for all those cabinet ministers screeching, politicising and  tweeting that there no vaccine shortage at all, I offe…",Also those cabinet ministers screeching politicising tweeting that there vaccine shortage offe,"['Also', 'those', 'cabinet', 'ministers', 'screeching', 'politicising', 'tweeting', 'that', 'there', 'vaccine', 'shortage', 'offe']","['cabinet', 'ministers', 'shortage', 'offe']", also cabinet minist screech politicis tweet vaccin shortag offe…,True,['@priyankac19'],[],[],6
2568,RT @laksr_tn: Achchacho...Did the government now become a lobbyist for  pharma companies?,RT @laksr_tn: Achchacho...Did the government now become a lobbyist for  pharma companies?,Achchacho government become lobbyist pharma companies,"['Achchacho', 'government', 'become', 'lobbyist', 'pharma', 'companies']","['government', 'companies']", achchacho govern becom lobbyist pharma compani ,True,['@laksr_tn'],[],[],6
2576,"RT @PLEKarnataka: Kannadigas have no shared history and culture with Naagas, Punjabis, Biharis and Gujaratis. 

Why should all these Nation…","RT @PLEKarnataka: Kannadigas have no shared history and culture with Naagas, Punjabis, Biharis and Gujaratis. 

Why should all these Nation…",Kannadigas have shared history culture with Naagas Punjabis Biharis Gujaratis should these Nation,"['Kannadigas', 'have', 'shared', 'history', 'culture', 'with', 'Naagas', 'Punjabis', 'Biharis', 'Gujaratis', 'should', 'these', 'Nation']","['Kannadigas', 'history', 'culture', 'Naagas', 'Punjabis', 'Biharis', 'Gujaratis', 'Nation']", kannadiga share histori cultur naaga punjabi bihari gujarati nation…,True,['@PLEKarnataka'],[],[],6
2585,RT @InderpalSinghD2: On this Vaisakhi we #CheatedHomeBuyers  across India inform @RBI @nsitharaman @HardeepSPuri @HomeLoansByHDFC @CarebyHD…,RT @InderpalSinghD2: On this Vaisakhi we #CheatedHomeBuyers  across India inform @RBI @nsitharaman @HardeepSPuri @HomeLoansByHDFC @CarebyHD…,this Vaisakhi #CheatedHomeBuyers across India inform,"['this', 'Vaisakhi', '#', 'CheatedHomeBuyers', 'across', 'India', 'inform']","['Vaisakhi', 'CheatedHomeBuyers', 'India', 'inform']", vaisakhi #cheatedhomebuyers across india inform …,True,['@InderpalSinghD2'],"['@RBI', '@nsitharaman', '@HardeepSPuri', '@HomeLoansByHDFC', '@CarebyHD']",['#CheatedHomeBuyers'],6
2586,RT @TheWolfpackIN: Top American Senator Todd Young says that imposing CAATSA sanctions on India for buying the multi-billion-dollar S-400 m…,RT @TheWolfpackIN: Top American Senator Todd Young says that imposing CAATSA sanctions on India for buying the multi-billion-dollar S-400 m…,American Senator Todd Young says that imposing CAATSA sanctions India buying multi billion dollar,"['American', 'Senator', 'Todd', 'Young', 'says', 'that', 'imposing', 'CAATSA', 'sanctions', 'India', 'buying', 'multi', 'billion', 'dollar']","['American', 'Senator', 'Todd', 'Young', 'CAATSA', 'sanctions', 'India', 'dollar']", top american senat todd young say impos caatsa sanction india buy multi billion dollar  m…,True,['@TheWolfpackIN'],[],[],6
2589,RT @JhaSanjay: Thank you Government of India for the decision to give EAU to all foreign approved vaccines. This was much needed to augment…,RT @JhaSanjay: Thank you Government of India for the decision to give EAU to all foreign approved vaccines. This was much needed to augment…,Thank Government India decision give foreign approved vaccines This much needed augment,"['Thank', 'Government', 'India', 'decision', 'give', 'foreign', 'approved', 'vaccines', 'This', 'much', 'needed', 'augment']","['Government', 'India', 'decision', 'vaccines', 'augment']", thank govern india decis give eau foreign approv vaccin much need augment…,True,['@JhaSanjay'],[],[],6
2597,"RT @RohitMaara: #VaadiVaasal trending in 27th position on India Trends 😎 🔥

Make it top @Suriya_offl bloods","RT @RohitMaara: #VaadiVaasal trending in 27th position on India Trends 😎 🔥

Make it top @Suriya_offl bloods",#VaadiVaasal trending position India Trends Make bloods,"['#', 'VaadiVaasal', 'trending', 'position', 'India', 'Trends', 'Make', 'bloods']","['VaadiVaasal', 'position', 'India', 'Trends', 'Make', 'bloods']", #vaadivaasal trend th posit india trend 😎 🔥 make top blood,True,['@RohitMaara'],['@Suriya_offl'],['#VaadiVaasal'],6
2633,RT @GowharGeelani: The apologetic tone and interrogative sentences when it is about the majoritarian discourse. In the case of scapegoats’…,RT @GowharGeelani: The apologetic tone and interrogative sentences when it is about the majoritarian discourse. In the case of scapegoats’…,apologetic tone interrogative sentences when about majoritarian discourse case scapegoats,"['apologetic', 'tone', 'interrogative', 'sentences', 'when', 'about', 'majoritarian', 'discourse', 'case', 'scapegoats']","['tone', 'sentences', 'discourse', 'case', 'scapegoats']", apologet tone interrog sentenc majoritarian discours case scapegoats’…,True,['@GowharGeelani'],[],[],6
2635,"RT @Rahinraj_Offl: • #VaadiVaasal trending in 27th position on India Trends 😎 

Make it top @Suriya_offl bloods","RT @Rahinraj_Offl: • #VaadiVaasal trending in 27th position on India Trends 😎 

Make it top @Suriya_offl bloods",#VaadiVaasal trending position India Trends Make bloods,"['#', 'VaadiVaasal', 'trending', 'position', 'India', 'Trends', 'Make', 'bloods']","['VaadiVaasal', 'position', 'India', 'Trends', 'Make', 'bloods']", #vaadivaasal trend th posit india trend 😎 make top blood,True,['@Rahinraj_Offl'],['@Suriya_offl'],['#VaadiVaasal'],6
2644,RT @VidyaKrishnan: Delighted? Mortuaries are running at full capacity.,RT @VidyaKrishnan: Delighted? Mortuaries are running at full capacity.,Delighted Mortuaries running full capacity,"['Delighted', 'Mortuaries', 'running', 'full', 'capacity']","['Mortuaries', 'capacity']", delight mortuari run full capac ,True,['@VidyaKrishnan'],[],[],6
2655,RT @VidyaKrishnan: Delighted? Mortuaries are running at full capacity.,RT @VidyaKrishnan: Delighted? Mortuaries are running at full capacity.,Delighted Mortuaries running full capacity,"['Delighted', 'Mortuaries', 'running', 'full', 'capacity']","['Mortuaries', 'capacity']", delight mortuari run full capac ,True,['@VidyaKrishnan'],[],[],6
2669,Are you looking for a vashikaran specialist in India? https://t.co/eoKUqnrSgy,Are you looking for a vashikaran specialist in India? ,looking vashikaran specialist India,"['looking', 'vashikaran', 'specialist', 'India']","['specialist', 'India']",look vashikaran specialist india ,False,[],[],[],6
2671,"RT @General_Oluchi: @pearlyima @AvrilAmaka You can hate Nigerian men but quote factual stats, because we all have access to the internet an…","RT @General_Oluchi: @pearlyima @AvrilAmaka You can hate Nigerian men but quote factual stats, because we all have access to the internet an…",hate Nigerian quote factual stats because have access internet,"['hate', 'Nigerian', 'quote', 'factual', 'stats', 'because', 'have', 'access', 'internet']","['hate', 'quote', 'stats', 'access', 'internet']", hate nigerian men quot factual stat access internet an…,True,['@General_Oluchi'],"['@pearlyima', '@AvrilAmaka']",[],6
2674,RT @JhaSanjay: Thank you Government of India for the decision to give EAU to all foreign approved vaccines. This was much needed to augment…,RT @JhaSanjay: Thank you Government of India for the decision to give EAU to all foreign approved vaccines. This was much needed to augment…,Thank Government India decision give foreign approved vaccines This much needed augment,"['Thank', 'Government', 'India', 'decision', 'give', 'foreign', 'approved', 'vaccines', 'This', 'much', 'needed', 'augment']","['Government', 'India', 'decision', 'vaccines', 'augment']", thank govern india decis give eau foreign approv vaccin much need augment…,True,['@JhaSanjay'],[],[],6
2705,“No Salaries For Those Absent”: Karnataka Chief Minister On Bus Employees’ Strike https://t.co/s920GvEwTM,“No Salaries For Those Absent”: Karnataka Chief Minister On Bus Employees’ Strike ,Salaries Those Absent Karnataka Chief Minister Employees Strike,"['Salaries', 'Those', 'Absent', 'Karnataka', 'Chief', 'Minister', 'Employees', 'Strike']","['Salaries', 'Absent', 'Karnataka', 'Chief', 'Minister', 'Employees', 'Strike']",“no salari absent” karnataka chief minist bu employees’ strike ,False,[],[],[],6
2706,"RT @priyankac19: Also, for all those cabinet ministers screeching, politicising and  tweeting that there no vaccine shortage at all, I offe…","RT @priyankac19: Also, for all those cabinet ministers screeching, politicising and  tweeting that there no vaccine shortage at all, I offe…",Also those cabinet ministers screeching politicising tweeting that there vaccine shortage offe,"['Also', 'those', 'cabinet', 'ministers', 'screeching', 'politicising', 'tweeting', 'that', 'there', 'vaccine', 'shortage', 'offe']","['cabinet', 'ministers', 'shortage', 'offe']", also cabinet minist screech politicis tweet vaccin shortag offe…,True,['@priyankac19'],[],[],6
2724,"WHY INDIA MUST KNOW ABOUT VAISAKHI
https://t.co/VLNt08xM0H","WHY INDIA MUST KNOW ABOUT VAISAKHI
",INDIA MUST KNOW ABOUT VAISAKHI,"['INDIA', 'MUST', 'KNOW', 'ABOUT', 'VAISAKHI']","['INDIA', 'MUST', 'KNOW', 'ABOUT', 'VAISAKHI']",india must know vaisakhi ,False,[],[],[],6
2735,"#WestBengal | Union Home Minister #AmitShah said if BJP forms government, it will provide the status of Scheduled T… https://t.co/DTnevce8tJ","#WestBengal | Union Home Minister #AmitShah said if BJP forms government, it will provide the status of Scheduled T… ",#WestBengal Union Home Minister #AmitShah said forms government will provide status Scheduled,"['#', 'WestBengal', 'Union', 'Home', 'Minister', '#', 'AmitShah', 'said', 'forms', 'government', 'will', 'provide', 'status', 'Scheduled']","['WestBengal', 'Union', 'Home', 'Minister', 'AmitShah', 'government', 'status']",#westbengal union home minist #amitshah said bjp form govern provid statu schedul t… ,False,[],[],"['#WestBengal', '#AmitShah']",6
2752,"RT @Suhelseth: You might also wish us Happy Vaisakhi, Ugadi, Navratri, and tomorrow, Vishu too. Since India IS one of your biggest markets.…","RT @Suhelseth: You might also wish us Happy Vaisakhi, Ugadi, Navratri, and tomorrow, Vishu too. Since India IS one of your biggest markets.…",might also wish Happy Vaisakhi Ugadi Navratri tomorrow Vishu Since India your biggest markets,"['might', 'also', 'wish', 'Happy', 'Vaisakhi', 'Ugadi', 'Navratri', 'tomorrow', 'Vishu', 'Since', 'India', 'your', 'biggest', 'markets']","['Happy', 'Vaisakhi', 'Ugadi', 'Navratri', 'tomorrow', 'Vishu', 'India', 'markets']", might also wish us happi vaisakhi ugadi navratri tomorrow vishu sinc india one biggest market …,True,['@Suhelseth'],[],[],6
2771,"RT @drharshvardhan: Delighted to share GoI's remarkable initiative to augment our basket of #COVID19vaccines

#COVIDVaccines which have bee…","RT @drharshvardhan: Delighted to share GoI's remarkable initiative to augment our basket of #COVID19vaccines

#COVIDVaccines which have bee…",Delighted share remarkable initiative augment basket #COVID vaccines #COVIDVaccines which have,"['Delighted', 'share', 'remarkable', 'initiative', 'augment', 'basket', '#', 'COVID', 'vaccines', '#', 'COVIDVaccines', 'which', 'have']","['share', 'augment', 'basket', 'COVID', 'vaccines', 'COVIDVaccines']", delight share goi remark initi augment basket #covidvaccines #covidvaccines bee…,True,['@drharshvardhan'],[],"['#COVID19vaccines', '#COVIDVaccines']",6
2779,"RT @AdiviSesh: I promised you #MajorTheFilm is an ALL INDIAN film because 

#MajorSandeepUnnikrishnan is INDIA’s SON. 

#MajorTeaser Trendi…","RT @AdiviSesh: I promised you #MajorTheFilm is an ALL INDIAN film because 

#MajorSandeepUnnikrishnan is INDIA’s SON. 

#MajorTeaser Trendi…",promised #MajorTheFilm INDIAN film because #MajorSandeepUnnikrishnan INDIA #MajorTeaser Trendi,"['promised', '#', 'MajorTheFilm', 'INDIAN', 'film', 'because', '#', 'MajorSandeepUnnikrishnan', 'INDIA', '#', 'MajorTeaser', 'Trendi']","['MajorTheFilm', 'INDIAN', 'film', 'MajorSandeepUnnikrishnan', 'INDIA', 'MajorTeaser', 'Trendi']", promis #majorthefilm indian film #majorsandeepunnikrishnan india’ son #majorteaser trendi…,True,['@AdiviSesh'],[],"['#MajorTheFilm', '#MajorSandeepUnnikrishnan', '#MajorTeaser']",6
2791,"RT @drharshvardhan: Delighted to share GoI's remarkable initiative to augment our basket of #COVID19vaccines

#COVIDVaccines which have bee…","RT @drharshvardhan: Delighted to share GoI's remarkable initiative to augment our basket of #COVID19vaccines

#COVIDVaccines which have bee…",Delighted share remarkable initiative augment basket #COVID vaccines #COVIDVaccines which have,"['Delighted', 'share', 'remarkable', 'initiative', 'augment', 'basket', '#', 'COVID', 'vaccines', '#', 'COVIDVaccines', 'which', 'have']","['share', 'augment', 'basket', 'COVID', 'vaccines', 'COVIDVaccines']", delight share goi remark initi augment basket #covidvaccines #covidvaccines bee…,True,['@drharshvardhan'],[],"['#COVID19vaccines', '#COVIDVaccines']",6
2804,RT @manojkjhadu: Art. 324 lies buried and thus the idea of ensuring level playing field. Fight on @MamataOfficial ji @RJDforIndia and @yada…,RT @manojkjhadu: Art. 324 lies buried and thus the idea of ensuring level playing field. Fight on @MamataOfficial ji @RJDforIndia and @yada…,lies buried thus idea ensuring level playing field Fight,"['lies', 'buried', 'thus', 'idea', 'ensuring', 'level', 'playing', 'field', 'Fight']","['lies', 'idea', 'field', 'Fight']", art  lie buri thu idea ensur level play field fight ji …,True,['@manojkjhadu'],"['@MamataOfficial', '@RJDforIndia', '@yada']",[],6
2805,RT @Jairam_Ramesh: 9 out of 12 members 'nominated' to the Rajya Sabha by the President have subsequently joined the BJP making a complete m…,RT @Jairam_Ramesh: 9 out of 12 members 'nominated' to the Rajya Sabha by the President have subsequently joined the BJP making a complete m…,members nominated Rajya Sabha President have subsequently joined making complete,"['members', 'nominated', 'Rajya', 'Sabha', 'President', 'have', 'subsequently', 'joined', 'making', 'complete']","['members', 'Rajya', 'Sabha', 'President']",   member nomin rajya sabha presid subsequ join bjp make complet m…,True,['@Jairam_Ramesh'],[],[],6
2808,"RT @Suhelseth: You might also wish us Happy Vaisakhi, Ugadi, Navratri, and tomorrow, Vishu too. Since India IS one of your biggest markets.…","RT @Suhelseth: You might also wish us Happy Vaisakhi, Ugadi, Navratri, and tomorrow, Vishu too. Since India IS one of your biggest markets.…",might also wish Happy Vaisakhi Ugadi Navratri tomorrow Vishu Since India your biggest markets,"['might', 'also', 'wish', 'Happy', 'Vaisakhi', 'Ugadi', 'Navratri', 'tomorrow', 'Vishu', 'Since', 'India', 'your', 'biggest', 'markets']","['Happy', 'Vaisakhi', 'Ugadi', 'Navratri', 'tomorrow', 'Vishu', 'India', 'markets']", might also wish us happi vaisakhi ugadi navratri tomorrow vishu sinc india one biggest market …,True,['@Suhelseth'],[],[],6
2825,"@fadeagbo @whitenigerian The real value comes in terms of employment, training of talent, investments into local te… https://t.co/14CNHnKJlP","@fadeagbo @whitenigerian The real value comes in terms of employment, training of talent, investments into local te… ",real value comes terms employment training talent investments into local,"['real', 'value', 'comes', 'terms', 'employment', 'training', 'talent', 'investments', 'into', 'local']","['value', 'terms', 'employment', 'training', 'talent', 'investments']", real valu come term employ train talent invest local te… ,False,[],"['@fadeagbo', '@whitenigerian']",[],6
2826,RT @BorisWatanabe: @OrwellNGoode No Indians care about this woke bs. He was hilarious as Apu. Everyone in India laughed at the accent. We h…,RT @BorisWatanabe: @OrwellNGoode No Indians care about this woke bs. He was hilarious as Apu. Everyone in India laughed at the accent. We h…,Indians care about this woke hilarious Everyone India laughed accent,"['Indians', 'care', 'about', 'this', 'woke', 'hilarious', 'Everyone', 'India', 'laughed', 'accent']","['Indians', 'woke', 'Everyone', 'India', 'accent']", indian care woke bs hilari apu everyon india laugh accent h…,True,['@BorisWatanabe'],['@OrwellNGoode'],[],6
2830,"RT @skpachauri11: @BJP4Karnataka @INCKarnataka @narendramodi Surat

SMIMER &amp; pvt hospitals refusing to admit patients 
300-350 patients are…","RT @skpachauri11: @BJP4Karnataka @INCKarnataka @narendramodi Surat

SMIMER &amp; pvt hospitals refusing to admit patients 
300-350 patients are…",Surat SMIMER hospitals refusing admit patients patients,"['Surat', 'SMIMER', 'hospitals', 'refusing', 'admit', 'patients', 'patients']","['Surat', 'SMIMER', 'hospitals', 'admit', 'patients', 'patients']", surat smimer amp pvt hospit refus admit patient   patient are…,True,['@skpachauri11'],"['@BJP4Karnataka', '@INCKarnataka', '@narendramodi']",[],6
